Id,holdingInstitution,NumOfProv,areaCode,placeCountry,placeName,placeLat,placeLon,timeStart,timeEnd,timeCentury,Today,locationName,locationLat,locationLon,locationType,MEIlink,startType,endType,locationLatFilled,locationLonFilled,timeStartFilled,timeEndFilled
02013774,"{u'country': u'GR', u'short': u'Athens, Laskaridis', u'name': u'Athens, Aikaterini Laskaridis Foundation'}",13,"[e-it, NoInfo, NoInfo, NoInfo, NoInfo, e-uk-en, e-uk-en, e-uk-en, n-us-pa, n-us-ny, e-uk-en, e-gr, e-gr]","[Italy, NoInfo, NoInfo, NoInfo, NoInfo, United Kingdom, United Kingdom, United Kingdom, United States, United States, United Kingdom, Greece, Greece]","[Florence, NoInfo, NoInfo, NoInfo, NoInfo, London, London, London, Latrobe, New York, London, Athens, Athens]","[43.77925, NoInfo, NoInfo, NoInfo, NoInfo, 51.50853, 51.50853, 51.50853, 40.32118, 40.71427, 51.50853, 37.98376, 37.98376]","[11.24626, NoInfo, NoInfo, NoInfo, NoInfo, -0.12574, -0.12574, -0.12574, -79.37948, -74.00597, -0.12574, 23.72784, 23.72784]","[1481, 1600, 1600, 1800, 1481, 1800, 1820, 1853, 1960, 2000, 2015, 2015, 2015]","[1481, 1800, 1700, 1900, 1600, 1820, 1853, 1882, 1999, 2000, 2015, 2015, 2021]","[[15], [16, 17, 18], [16, 17], [18, 19], [15, 16], [18, 19], [19], [19], [20], [20], [21], [21], [21]]",True,"[Italy, NoInfo, NoInfo, NoInfo, NoInfo, United Kingdom, United Kingdom, United Kingdom, United States, United States, United Kingdom, Greece, Greece]","[43.77925, NoInfo, NoInfo, NoInfo, NoInfo, 51.50853, 51.50853, 51.50853, 40.32118, 40.71427, 51.50853, 37.98376, 37.98376]","[11.24626, NoInfo, NoInfo, NoInfo, NoInfo, -0.12574, -0.12574, -0.12574, -79.37948, -74.00597, -0.12574, 23.72784, 23.72784]","[accurate, NoInfo, NoInfo, NoInfo, NoInfo, accurate, accurate, accurate, accurate, accurate, accurate, accurate, accurate]",https://data.cerl.org/mei/02013774,"[accurate, approx, approx, approx, accurate, approx, accurate, accurate, accurate, approx, accurate, accurate, accurate]","[accurate, approx, approx, approx, approx, accurate, accurate, accurate, accurate, approx, accurate, accurate, accurate]","[43.77925, 43.77925, 43.77925, 43.77925, 43.77925, 51.50853, 51.50853, 51.50853, 40.32118, 40.71427, 51.50853, 37.98376, 37.98376]","[11.24626, 11.24626, 11.24626, 11.24626, 11.24626, -0.12574, -0.12574, -0.12574, -79.37948, -74.00597, -0.12574, 23.72784, 23.72784]","[1481, 1600, 1600, 1800, 1481, 1800, 1820, 1853, 1960, 2000, 2015, 2015, 2015]","[1481, 1800, 1700, 1900, 1600, 1820, 1853, 1882, 1999, 2000, 2015, 2015, 2021]"
02016450,"{u'country': u'IT', u'short': u'Venezia N', u'name': u'Venezia, Biblioteca Nazionale Marciana'}",7,"[e-it, e-xv, e-it, e-it, e-it, e-it, e-it]","[Italy, Slovenia, NoInfo, Italy, Italy, Italy, Italy]","[Florence, Koper, NoInfo, Florence, Venice, Venice, Venice]","[43.77925, 45.54694, NoInfo, 43.77925, 45.43713, 45.43713, 45.43713]","[11.24626, 13.72944, NoInfo, 11.24626, 12.33265, 12.33265, 12.33265]","[1481, 1481, 1488, 1545, 1690, 1750, 1810]","[1481, 1488, 1525, 1625, 1750, 1810, 2021]","[[15], [15], [15, 16], [16, 17], [17, 18], [18, 19], [19]]",True,"[Italy, Slovenia, Italy, Italy, Italy, Italy, Italy]","[43.77925, 45.54694, 42.83333, 43.77925, 45.43713, 45.43713, 45.43713]","[11.24626, 13.72944, 12.83333, 11.24626, 12.33265, 12.33265, 12.33265]","[accurate, accurate, approx, accurate, accurate, accurate, accurate]",https://data.cerl.org/mei/02016450,"[accurate, accurate, accurate, accurate, accurate, approx, accurate]","[accurate, accurate, accurate, accurate, approx, accurate, accurate]","[43.77925, 45.54694, 42.83333, 43.77925, 45.43713, 45.43713, 45.43713]","[11.24626, 13.72944, 12.83333, 11.24626, 12.33265, 12.33265, 12.33265]","[1481, 1481, 1488, 1545, 1690, 1750, 1810]","[1481, 1488, 1525, 1625, 1750, 1810, 2021]"
02128758,"{u'country': u'US', u'short': u'Wellesley College Library', u'name': u'Wellesley College Library'}",6,"[e-it, e-it, e-it, n-us, n-us-ny, n-us-ma]","[Italy, Italy, Italy, United States, United States, United States]","[Florence, Italy, Italy, New York, New York, Wellesley]","[43.77925, 42.83333, 42.83333, 40.71427, 40.71427, 42.29649]","[11.24626, 12.83333, 12.83333, -74.00597, -74.00597, -71.29256]","[1481, 1481, 1650, 1901, 1907, 1907]","[1481, 1500, 1750, 1907, NoInfo, 2021]","[[15], [15], [17, 18], [20], [20], [20]]",True,"[Italy, Italy, Italy, United States, United States, United States]","[43.77925, 42.83333, 42.83333, 40.71427, 40.71427, 42.29649]","[11.24626, 12.83333, 12.83333, -74.00597, -74.00597, -71.29256]","[accurate, accurate, accurate, accurate, accurate, accurate]",https://data.cerl.org/mei/02128758,"[accurate, accurate, approx, accurate, accurate, accurate]","[accurate, approx, approx, accurate, NoInfo, accurate]","[43.77925, 42.83333, 42.83333, 40.71427, 40.71427, 42.29649]","[11.24626, 12.83333, 12.83333, -74.00597, -74.00597, -71.29256]","[1481, 1481, 1650, 1901, 1907, 1907]","[1481, 1500, 1750, 1907, 1907, 2021]"
02140739,"{u'country': u'IT', u'short': u'Modena Est', u'name': u'Modena, Biblioteca Estense ed Universitaria'}",5,"[e-it, e-it, NoInfo, e-it, e-it]","[Italy, NoInfo, NoInfo, Italy, Italy]","[Florence, NoInfo, NoInfo, Modena, Modena]","[43.77925, NoInfo, NoInfo, 44.64783, 44.64783]","[11.24626, NoInfo, NoInfo, 10.92539, 10.92539]","[1481, 1601, 1801, 1900, 1970]","[1481, 1700, 1900, 1970, 2021]","[[15], [17], [19], [19, 20], [20]]",True,"[Italy, Italy, NoInfo, Italy, Italy]","[43.77925, 42.83333, NoInfo, 44.64783, 44.64783]","[11.24626, 12.83333, NoInfo, 10.92539, 10.92539]","[accurate, approx, NoInfo, accurate, accurate]",https://data.cerl.org/mei/02140739,"[accurate, accurate, accurate, approx, accurate]","[accurate, approx, approx, accurate, accurate]","[43.77925, 42.83333, 42.83333, 44.64783, 44.64783]","[11.24626, 12.83333, 12.83333, 10.92539, 10.92539]","[1481, 1601, 1801, 1900, 1970]","[1481, 1700, 1900, 1970, 2021]"
02141240,"{u'country': u'GB', u'short': u'GlasgowPL', u'name': u'Glasgow, Mitchell Library'}",7,"[e-it, e-it, NoInfo, e-uk-st, e-uk-st, e-uk-st, e-uk-st]","[Italy, NoInfo, NoInfo, United Kingdom, United Kingdom, United Kingdom, United Kingdom]","[Florence, NoInfo, NoInfo, Glasgow, Glasgow, Glasgow, Glasgow]","[43.77925, NoInfo, NoInfo, 55.86515, 55.86515, 55.86515, 55.86515]","[11.24626, NoInfo, NoInfo, -4.25763, -4.25763, -4.25763, -4.25763]","[1481, 1481, 1700, NoInfo, 1848, 1874, 1874]","[1481, 1600, 1800, 1848, NoInfo, NoInfo, 2021]","[[15], [15, 16], [17, 18], [15, 16, 17, 18, 19], [19], [19], [19]]",True,"[Italy, Italy, NoInfo, United Kingdom, United Kingdom, United Kingdom, United Kingdom]","[43.77925, 42.83333, NoInfo, 55.86515, 55.86515, 55.86515, 55.86515]","[11.24626, 12.83333, NoInfo, -4.25763, -4.25763, -4.25763, -4.25763]","[accurate, approx, NoInfo, accurate, accurate, accurate, accurate]",https://data.cerl.org/mei/02141240,"[accurate, accurate, approx, NoInfo, accurate, accurate, accurate]","[accurate, approx, approx, accurate, NoInfo, NoInfo, accurate]","[43.77925, 42.83333, 42.83333, 55.86515, 55.86515, 55.86515, 55.86515]","[11.24626, 12.83333, 12.83333, -4.25763, -4.25763, -4.25763, -4.25763]","[1481, 1481, 1700, 1700, 1848, 1874, 1874]","[1481, 1600, 1800, 1848, 1848, 1848, 2021]"
02140723,"{u'country': u'IT', u'short': u'Genova C', u'name': u'Genova, Biblioteca Civica Berio'}",4,"[e-it, e-it, e-it, e-it]","[Italy, NoInfo, Italy, Italy]","[Florence, NoInfo, Genoa, Genoa]","[43.77925, NoInfo, 44.40478, 44.40478]","[11.24626, NoInfo, 8.94439, 8.94439]","[1481, 1501, 1852, 1900]","[1481, 1700, 1935, 2021]","[[15], [16, 17], [19, 20], [19]]",True,"[Italy, Italy, Italy, Italy]","[43.77925, 42.83333, 44.40478, 44.40478]","[11.24626, 12.83333, 8.94439, 8.94439]","[accurate, approx, accurate, accurate]",https://data.cerl.org/mei/02140723,"[accurate, accurate, accurate, approx]","[accurate, approx, accurate, accurate]","[43.77925, 42.83333, 44.40478, 44.40478]","[11.24626, 12.83333, 8.94439, 8.94439]","[1481, 1501, 1852, 1900]","[1481, 1700, 1935, 2021]"
02140988,"{u'country': u'FR', u'short': u'Paris Petit Palais', u'name': u'Paris, Musée du Petit Palais'}",4,"[e-it, e-it, e-fr, e-fr]","[Italy, NoInfo, France, France]","[Florence, NoInfo, Marseille, Paris]","[43.77925, NoInfo, 43.29695, 48.85341]","[11.24626, NoInfo, 5.38107, 2.3488]","[1481, 1481, 1840, 1902]","[1481, 1500, 1886, 2021]","[[15], [15], [19], [20]]",True,"[Italy, Italy, France, France]","[43.77925, 42.83333, 43.29695, 48.85341]","[11.24626, 12.83333, 5.38107, 2.3488]","[accurate, approx, accurate, accurate]",https://data.cerl.org/mei/02140988,"[accurate, accurate, accurate, accurate]","[accurate, approx, accurate, accurate]","[43.77925, 42.83333, 43.29695, 48.85341]","[11.24626, 12.83333, 5.38107, 2.3488]","[1481, 1481, 1840, 1902]","[1481, 1500, 1886, 2021]"
02140750,"{u'country': u'IT', u'short': u'Napoli U', u'name': u'Napoli, Biblioteca Universitaria'}",3,"[e-it, e-it, e-it]","[Italy, Italy, Italy]","[Florence, Naples, Naples]","[43.77925, 40.85216, 40.85216]","[11.24626, 14.26811, 14.26811]","[1481, 1812, 1816]","[1481, 1815, 2021]","[[15], [19], [19]]",True,"[Italy, Italy, Italy]","[43.77925, 40.85216, 40.85216]","[11.24626, 14.26811, 14.26811]","[accurate, accurate, accurate]",https://data.cerl.org/mei/02140750,"[accurate, accurate, accurate]","[accurate, accurate, accurate]","[43.77925, 40.85216, 40.85216]","[11.24626, 14.26811, 14.26811]","[1481, 1812, 1816]","[1481, 1815, 2021]"
02140752,"{u'country': u'IT', u'short': u'Pisa U', u'name': u'Pisa, Biblioteca Universitaria'}",4,"[e-it, e-it, e-it, e-it]","[Italy, NoInfo, Italy, Italy]","[Florence, NoInfo, Pisa, Pisa]","[43.77925, NoInfo, 43.70853, 43.70853]","[11.24626, NoInfo, 10.4036, 10.4036]","[1481, 1481, NoInfo, 1742]","[1481, 1800, NoInfo, 2021]","[[15], [15, 16, 17, 18], NoInfo, [18]]",True,"[Italy, Italy, Italy, Italy]","[43.77925, 42.83333, 43.70853, 43.70853]","[11.24626, 12.83333, 10.4036, 10.4036]","[accurate, approx, accurate, accurate]",https://data.cerl.org/mei/02140752,"[accurate, accurate, NoInfo, accurate]","[accurate, approx, NoInfo, accurate]","[43.77925, 42.83333, 43.70853, 43.70853]","[11.24626, 12.83333, 10.4036, 10.4036]","[1481, 1481, 1481, 1742]","[1481, 1800, 1800, 2021]"
02140760,"{u'country': u'IT', u'short': u'Poppi C', u'name': u'Poppi, Biblioteca Comunale Rilli - Vettori'}",3,"[e-it, e-it, e-it]","[Italy, Italy, Italy]","[Florence, Poppi, Poppi]","[43.77925, 43.72123, 43.72123]","[11.24626, 11.76642, 11.76642]","[1481, 1745, 1825]","[1481, 1825, 2021]","[[15], [18, 19], [19]]",True,"[Italy, Italy, Italy]","[43.77925, 43.72123, 43.72123]","[11.24626, 11.76642, 11.76642]","[accurate, accurate, accurate]",https://data.cerl.org/mei/02140760,"[accurate, accurate, accurate]","[accurate, accurate, accurate]","[43.77925, 43.72123, 43.72123]","[11.24626, 11.76642, 11.76642]","[1481, 1745, 1825]","[1481, 1825, 2021]"
02140687,"{u'country': u'IT', u'short': u'BUB', u'name': u'Bologna, Biblioteca Universitaria'}",3,"[e-it, e-it, e-it]","[Italy, NoInfo, Italy]","[Florence, NoInfo, Bologna]","[43.77925, NoInfo, 44.46667]","[11.24626, NoInfo, 11.43333]","[1481, 1481, 1712]","[1481, 1500, 2021]","[[15], [15], [18]]",True,"[Italy, Italy, Italy]","[43.77925, 42.83333, 44.46667]","[11.24626, 12.83333, 11.43333]","[accurate, approx, accurate]",https://data.cerl.org/mei/02140687,"[accurate, accurate, accurate]","[accurate, approx, accurate]","[43.77925, 42.83333, 44.46667]","[11.24626, 12.83333, 11.43333]","[1481, 1481, 1712]","[1481, 1500, 2021]"
02117472,"{u'country': u'AT', u'short': u'Wien, ONB', u'name': u'Wien, Österreichische  Nationalbibliothek'}",3,"[e-it, e-it, e-au]","[Italy, NoInfo, Austria]","[Florence, NoInfo, Vienna]","[43.77925, NoInfo, 48.2082]","[11.24626, NoInfo, 16.37169]","[1481, 1481, 1807]","[1481, 1600, 2021]","[[15], [15, 16], [19]]",True,"[Italy, Italy, Austria]","[43.77925, 42.83333, 48.2082]","[11.24626, 12.83333, 16.37169]","[accurate, approx, accurate]",https://data.cerl.org/mei/02117472,"[accurate, accurate, accurate]","[accurate, approx, accurate]","[43.77925, 42.83333, 48.2082]","[11.24626, 12.83333, 16.37169]","[1481, 1481, 1807]","[1481, 1600, 2021]"
02141109,"{u'country': u'IT', u'short': u'Pavia C', u'name': u'Pavia, Biblioteca Civica ""Carlo Bonetta""'}",4,"[e-it, e-it, e-it, e-it]","[Italy, NoInfo, Italy, Italy]","[Florence, NoInfo, Pavia, Pavia]","[43.77925, NoInfo, 45.19205, 45.19205]","[11.24626, NoInfo, 9.15917, 9.15917]","[1481, 1481, 1754, 1835]","[1481, 1600, 1835, 2021]","[[15], [15, 16], [18, 19], [19]]",True,"[Italy, Italy, Italy, Italy]","[43.77925, 42.83333, 45.19205, 45.19205]","[11.24626, 12.83333, 9.15917, 9.15917]","[accurate, approx, accurate, accurate]",https://data.cerl.org/mei/02141109,"[accurate, accurate, accurate, accurate]","[accurate, approx, accurate, accurate]","[43.77925, 42.83333, 45.19205, 45.19205]","[11.24626, 12.83333, 9.15917, 9.15917]","[1481, 1481, 1754, 1835]","[1481, 1600, 1835, 2021]"
02141099,"{u'country': u'IT', u'short': u'Verona Cap', u'name': u'Verona, Biblioteca Capitolare'}",6,"[e-it, e-it, e-it, e-it, e-it, e-it]","[Italy, NoInfo, Italy, Italy, Italy, Italy]","[Florence, NoInfo, Florence, Florence, Verona, Verona]","[43.77925, NoInfo, 43.77925, 43.77925, 45.4299, 45.4299]","[11.24626, NoInfo, 11.24626, 11.24626, 10.98444, 10.98444]","[1481, 1481, 1750, 1791, 1791, 1821]","[1481, 1600, 1791, 1803, 1808, 2021]","[[15], [15, 16], [18], [18, 19], [18, 19], [19]]",True,"[Italy, Italy, Italy, Italy, Italy, Italy]","[43.77925, 42.83333, 43.77925, 43.77925, 45.4299, 45.4299]","[11.24626, 12.83333, 11.24626, 11.24626, 10.98444, 10.98444]","[accurate, approx, accurate, accurate, accurate, accurate]",https://data.cerl.org/mei/02141099,"[accurate, accurate, approx, accurate, accurate, accurate]","[accurate, approx, accurate, accurate, accurate, accurate]","[43.77925, 42.83333, 43.77925, 43.77925, 45.4299, 45.4299]","[11.24626, 12.83333, 11.24626, 11.24626, 10.98444, 10.98444]","[1481, 1481, 1750, 1791, 1791, 1821]","[1481, 1600, 1791, 1803, 1808, 2021]"
02141102,"{u'country': u'LV', u'short': u'Riga NL', u'name': u'Riga, National Library of Latvia'}",5,"[e-it, e-it, NoInfo, e-lv, e-lv]","[Italy, NoInfo, NoInfo, Latvia, Latvia]","[Florence, NoInfo, NoInfo, Iecava, Riga]","[43.77925, NoInfo, NoInfo, 56.59766, 56.946]","[11.24626, NoInfo, NoInfo, 24.20763, 24.10589]","[1481, 1481, 1501, 1834, 1919]","[1481, 1500, 1600, 1908, 2021]","[[15], [15], [16], [19, 20], [20]]",True,"[Italy, Italy, NoInfo, Latvia, Latvia]","[43.77925, 42.83333, NoInfo, 56.59766, 56.946]","[11.24626, 12.83333, NoInfo, 24.20763, 24.10589]","[accurate, approx, NoInfo, accurate, accurate]",https://data.cerl.org/mei/02141102,"[accurate, accurate, accurate, accurate, accurate]","[accurate, approx, approx, accurate, accurate]","[43.77925, 42.83333, 42.83333, 56.59766, 56.946]","[11.24626, 12.83333, 12.83333, 24.20763, 24.10589]","[1481, 1481, 1501, 1834, 1919]","[1481, 1500, 1600, 1908, 2021]"
02141016,"{u'country': u'IT', u'short': u'Firenze Min', u'name': u'Firenze, Biblioteca Provinciale dei Frati Minori'}",6,"[e-it, e-it, e-it, e-it, e-it, e-it]","[Italy, NoInfo, NoInfo, NoInfo, Italy, Italy]","[Florence, NoInfo, NoInfo, NoInfo, Bibbiena, Figline Valdarno]","[43.77925, NoInfo, NoInfo, NoInfo, 43.69876, 43.61995]","[11.24626, NoInfo, NoInfo, NoInfo, 11.81474, 11.47191]","[1481, 1481, 1501, 1481, 1481, 1926]","[1481, 1500, 1600, 1600, 1985, 2021]","[[15], [15], [16], [15, 16], [15, 16, 17, 18, 19, 20], [20]]",True,"[Italy, Italy, Italy, Italy, Italy, Italy]","[43.77925, 42.83333, 42.83333, 42.83333, 43.69876, 43.61995]","[11.24626, 12.83333, 12.83333, 12.83333, 11.81474, 11.47191]","[accurate, approx, approx, approx, accurate, accurate]",https://data.cerl.org/mei/02141016,"[accurate, accurate, accurate, accurate, accurate, accurate]","[accurate, approx, approx, approx, accurate, accurate]","[43.77925, 42.83333, 42.83333, 42.83333, 43.69876, 43.61995]","[11.24626, 12.83333, 12.83333, 12.83333, 11.81474, 11.47191]","[1481, 1481, 1501, 1481, 1481, 1926]","[1481, 1500, 1600, 1600, 1985, 2021]"
02141110,"{u'country': u'IT', u'short': u'Grottaferrata Badia', u'name': u'Grottaferrata, Biblioteca dell'Abbazia di Santa Maria di Grottaferrata'}",4,"[e-it, e-it, e-it, e-it]","[Italy, NoInfo, NoInfo, NoInfo]","[Florence, NoInfo, NoInfo, NoInfo]","[43.77925, NoInfo, NoInfo, NoInfo]","[11.24626, NoInfo, NoInfo, NoInfo]","[1481, 1481, 1481, 1800]","[1481, 1600, 1600, 2021]","[[15], [15, 16], [15, 16], [18]]",True,"[Italy, Italy, Italy, Italy]","[43.77925, 42.83333, 42.83333, 42.83333]","[11.24626, 12.83333, 12.83333, 12.83333]","[accurate, approx, approx, approx]",https://data.cerl.org/mei/02141110,"[accurate, accurate, accurate, approx]","[accurate, approx, approx, accurate]","[43.77925, 42.83333, 42.83333, 42.83333]","[11.24626, 12.83333, 12.83333, 12.83333]","[1481, 1481, 1481, 1800]","[1481, 1600, 1600, 2021]"
02141427,"{u'country': u'VA', u'short': u'Vaticano BAV', u'name': u'Città del Vaticano, Biblioteca Apostolica Vaticana'}",3,"[e-it, e-it, e-vat]","[Italy, NoInfo, Vatican City]","[Florence, NoInfo, Vatican City]","[43.77925, NoInfo, 41.90225]","[11.24626, NoInfo, 12.4533]","[1481, 1601, 1700]","[1481, 1700, 2021]","[[15], [17], [17]]",True,"[Italy, Italy, Vatican City]","[43.77925, 42.83333, 41.90225]","[11.24626, 12.83333, 12.4533]","[accurate, approx, accurate]",https://data.cerl.org/mei/02141427,"[accurate, accurate, approx]","[accurate, approx, accurate]","[43.77925, 42.83333, 41.90225]","[11.24626, 12.83333, 12.4533]","[1481, 1601, 1700]","[1481, 1700, 2021]"
02141456,"{u'country': u'IT', u'short': u'Roma Casa Dante', u'name': u'Roma, Casa di Dante'}",5,"[e-it, e-it, e-it, NoInfo, e-it]","[Italy, NoInfo, NoInfo, NoInfo, Italy]","[Florence, NoInfo, NoInfo, NoInfo, Rome]","[43.77925, NoInfo, NoInfo, NoInfo, 41.89193]","[11.24626, NoInfo, NoInfo, NoInfo, 12.51133]","[1481, 1481, 1501, 1719, 1913]","[1481, 1600, 1600, 1720, 2021]","[[15], [15, 16], [16], [18], [20]]",True,"[Italy, Italy, Italy, NoInfo, Italy]","[43.77925, 42.83333, 42.83333, NoInfo, 41.89193]","[11.24626, 12.83333, 12.83333, NoInfo, 12.51133]","[accurate, approx, approx, NoInfo, accurate]",https://data.cerl.org/mei/02141456,"[accurate, accurate, accurate, accurate, accurate]","[accurate, approx, approx, accurate, accurate]","[43.77925, 42.83333, 42.83333, 42.83333, 41.89193]","[11.24626, 12.83333, 12.83333, 12.83333, 12.51133]","[1481, 1481, 1501, 1719, 1913]","[1481, 1600, 1600, 1720, 2021]"
02140731,"{u'country': u'IT', u'short': u'Lucca, Statale', u'name': u'Lucca, Statale'}",5,"[e-it, e-it, e-it, e-it, e-it]","[Italy, NoInfo, NoInfo, Italy, Italy]","[Florence, NoInfo, NoInfo, Savona, Lucca]","[43.77925, NoInfo, NoInfo, 44.30905, 43.84369]","[11.24626, NoInfo, NoInfo, 8.47715, 10.50447]","[1481, 1481, 1481, 1647, 1794]","[1481, 1600, 1600, 1647, 2021]","[[15], [15, 16], [15, 16], [17], [18]]",True,"[Italy, Italy, Italy, Italy, Italy]","[43.77925, 42.83333, 42.83333, 44.30905, 43.84369]","[11.24626, 12.83333, 12.83333, 8.47715, 10.50447]","[accurate, approx, approx, accurate, accurate]",https://data.cerl.org/mei/02140731,"[accurate, accurate, accurate, accurate, accurate]","[accurate, approx, approx, accurate, accurate]","[43.77925, 42.83333, 42.83333, 44.30905, 43.84369]","[11.24626, 12.83333, 12.83333, 8.47715, 10.50447]","[1481, 1481, 1481, 1647, 1794]","[1481, 1600, 1600, 1647, 2021]"
02141434,"{u'country': u'VA', u'short': u'Vaticano BAV', u'name': u'Città del Vaticano, Biblioteca Apostolica Vaticana'}",7,"[e-it, e-it, e-it, e-it, e-it, e-it, e-vat]","[Italy, NoInfo, Italy, NoInfo, NoInfo, Italy, Vatican City]","[Florence, NoInfo, San Casciano in Val di Pesa, NoInfo, NoInfo, Rome, Vatican City]","[43.77925, NoInfo, 43.65975, NoInfo, NoInfo, 41.89193, 41.90225]","[11.24626, NoInfo, 11.18494, NoInfo, NoInfo, 12.51133, 12.4533]","[1481, 1481, 1481, 1601, 1501, 1722, 1746]","[1481, 1500, NoInfo, 1700, 1700, 1746, 2021]","[[15], [15], [15], [17], [16, 17], [18], [18]]",True,"[Italy, Italy, Italy, Italy, Italy, Italy, Vatican City]","[43.77925, 42.83333, 43.65975, 42.83333, 42.83333, 41.89193, 41.90225]","[11.24626, 12.83333, 11.18494, 12.83333, 12.83333, 12.51133, 12.4533]","[accurate, approx, accurate, approx, approx, accurate, accurate]",https://data.cerl.org/mei/02141434,"[accurate, accurate, accurate, accurate, accurate, accurate, accurate]","[accurate, approx, NoInfo, approx, approx, accurate, accurate]","[43.77925, 42.83333, 43.65975, 42.83333, 42.83333, 41.89193, 41.90225]","[11.24626, 12.83333, 11.18494, 12.83333, 12.83333, 12.51133, 12.4533]","[1481, 1481, 1481, 1601, 1501, 1722, 1746]","[1481, 1500, 1500, 1700, 1700, 1746, 2021]"
02141204,"{u'country': u'US', u'short': u'Harvard Houghton', u'name': u'Cambridge MA, Harvard Library, Houghton Library'}",7,"[e-it, e-it, e, e-it, e-it, n-us-ma, n-us-ma]","[Italy, Italy, NoInfo, Italy, Italy, United States, United States]","[Florence, Florence, Europe, Florence, Bologna, Cambridge, Cambridge]","[43.77925, 43.77925, 48.69096, 43.77925, 44.49381, 42.3751, 42.3751]","[11.24626, 11.24626, 9.14062, 11.24626, 11.33875, -71.10561, -71.10561]","[1481, 1481, 1501, 1728, 1871, 1871, 1905]","[1481, 1503, 1600, 1728, 1871, 1905, 2021]","[[15], [15, 16], [16], [18], [19], [19, 20], [20]]",True,"[Italy, Italy, NoInfo, Italy, Italy, United States, United States]","[43.77925, 43.77925, 48.69096, 43.77925, 44.49381, 42.3751, 42.3751]","[11.24626, 11.24626, 9.14062, 11.24626, 11.33875, -71.10561, -71.10561]","[accurate, accurate, accurate, accurate, accurate, accurate, accurate]",https://data.cerl.org/mei/02141204,"[accurate, accurate, accurate, accurate, accurate, accurate, accurate]","[accurate, accurate, approx, accurate, accurate, accurate, accurate]","[43.77925, 43.77925, 48.69096, 43.77925, 44.49381, 42.3751, 42.3751]","[11.24626, 11.24626, 9.14062, 11.24626, 11.33875, -71.10561, -71.10561]","[1481, 1481, 1501, 1728, 1871, 1871, 1905]","[1481, 1503, 1600, 1728, 1871, 1905, 2021]"
02141492,"{u'country': u'US', u'short': u'New York Public Library, Spencer Collection', u'name': u'New York Public Library, Spencer Collection'}",5,"[e-it, e-it, e-uk-en, n-us-ny, n-us-ny]","[Italy, Italy, United Kingdom, United States, United States]","[Florence, Naples, Althorp, New York, New York]","[43.77925, 40.85216, 52.28107, 40.71427, 40.71427]","[11.24626, 14.26811, -1.00095, -74.00597, -74.00597]","[1481, 1747, 1819, 1855, 1913]","[1481, 1825, 1834, 1912, 2021]","[[15], [18, 19], [19], [19, 20], [20]]",True,"[Italy, Italy, United Kingdom, United States, United States]","[43.77925, 40.85216, 52.28107, 40.71427, 40.71427]","[11.24626, 14.26811, -1.00095, -74.00597, -74.00597]","[accurate, accurate, accurate, accurate, accurate]",https://data.cerl.org/mei/02141492,"[accurate, accurate, accurate, accurate, accurate]","[accurate, accurate, accurate, accurate, accurate]","[43.77925, 40.85216, 52.28107, 40.71427, 40.71427]","[11.24626, 14.26811, -1.00095, -74.00597, -74.00597]","[1481, 1747, 1819, 1855, 1913]","[1481, 1825, 1834, 1912, 2021]"
02145052,"{u'short': u'Historical Copy', u'name': u'Historical Copy'}",10,"[e-it, e-it, e-it, e-uk, e-uk-en, n-us-ri, n-us, n-us-ny, n-us-ny, e-gx]","[Italy, NoInfo, Italy, United Kingdom, United Kingdom, United States, United States, United States, United States, Germany]","[Florence, NoInfo, Florence, Narford, London, Newport, New York, New York, New York, Schweinfurt]","[43.77925, NoInfo, 43.77925, 52.68333, 51.50853, 41.4901, 40.71427, 40.71427, 40.71427, 50.04937]","[11.24626, NoInfo, 11.24626, 0.61667, -0.12574, -71.31283, -74.00597, -74.00597, -74.00597, 10.22175]","[1481, 1500, 1500, 1714, 1902, 1919, 1934, 1953, 1958, 1958]","[1481, 1600, 1600, 1902, 1918, 1933, 1949, 1958, 1958, 1994]","[[15], [15, 16], [15, 16], [18, 19, 20], [20], [20], [20], [20], [20], [20]]",False,"[Italy, Italy, Italy, United Kingdom, United Kingdom, United States, United States, United States, United States, Germany]","[43.77925, 42.83333, 43.77925, 52.68333, 51.50853, 41.4901, 40.71427, 40.71427, 40.71427, 50.04937]","[11.24626, 12.83333, 11.24626, 0.61667, -0.12574, -71.31283, -74.00597, -74.00597, -74.00597, 10.22175]","[accurate, approx, accurate, accurate, accurate, accurate, accurate, accurate, accurate, accurate]",https://data.cerl.org/mei/02145052,"[accurate, approx, approx, accurate, accurate, accurate, accurate, accurate, accurate, accurate]","[accurate, approx, approx, accurate, accurate, accurate, accurate, accurate, accurate, accurate]","[43.77925, 42.83333, 43.77925, 52.68333, 51.50853, 41.4901, 40.71427, 40.71427, 40.71427, 50.04937]","[11.24626, 12.83333, 11.24626, 0.61667, -0.12574, -71.31283, -74.00597, -74.00597, -74.00597, 10.22175]","[1481, 1500, 1500, 1714, 1902, 1919, 1934, 1953, 1958, 1958]","[1481, 1600, 1600, 1902, 1918, 1933, 1949, 1958, 1958, 1994]"
