Id,holdingInstitution,NumOfProv,areaCode,placeCountry,placeName,placeLat,placeLon,timeStart,timeEnd,timeCentury,Today,locationName,locationLat,locationLon,locationType,MEIlink,startType,endType,locationLatFilled,locationLonFilled,timeStartFilled,timeEndFilled
02001009,"{u'country': u'GB', u'isil': u'GB-Uk', u'name': u'London, British Library', u'short': u'London BL'}",4,"[e-it, e-it, e-it, e-uk]","[Italy, NoInfo, NoInfo, United Kingdom]","[Florence, NoInfo, NoInfo, London]","[43.77925, NoInfo, NoInfo, 51.50853]","[11.24626, NoInfo, NoInfo, -0.12574]","[1481, 1475, 1750, 1842]","[1481, 1525, 1825, 2021]","[[15], [15, 16], [18, 19], [19]]",True,"[Italy, Italy, Italy, United Kingdom]","[43.77925, 42.83333, 42.83333, 51.50853]","[11.24626, 12.83333, 12.83333, -0.12574]","[accurate, approx, approx, accurate]",https://data.cerl.org/mei/02001009,"[accurate, accurate, approx, accurate]","[accurate, accurate, accurate, accurate]","[43.77925, 42.83333, 42.83333, 51.50853]","[11.24626, 12.83333, 12.83333, -0.12574]","[1481, 1475, 1750, 1842]","[1481, 1525, 1825, 2021]"
02140856,"{u'country': u'GB', u'isil': u'GB-Uk', u'name': u'London, British Library', u'short': u'London BL'}",4,"[e-it, e-it, e-uk, e-uk]","[Italy, Italy, United Kingdom, United Kingdom]","[Florence, Florence, London, London]","[43.77925, 43.77925, 51.50853, 51.50853]","[11.24626, 11.24626, -0.12574, -0.12574]","[1481, 1550, 1650, 1757]","[1481, 1605, 1757, 2021]","[[15], [16, 17], [17, 18], [18]]",True,"[Italy, Italy, United Kingdom, United Kingdom]","[43.77925, 43.77925, 51.50853, 51.50853]","[11.24626, 11.24626, -0.12574, -0.12574]","[accurate, accurate, accurate, accurate]",https://data.cerl.org/mei/02140856,"[accurate, approx, approx, accurate]","[accurate, accurate, accurate, accurate]","[43.77925, 43.77925, 51.50853, 51.50853]","[11.24626, 11.24626, -0.12574, -0.12574]","[1481, 1550, 1650, 1757]","[1481, 1605, 1757, 2021]"
02140784,"{u'country': u'IT', u'short': u'Siena C', u'name': u'Siena, Biblioteca Comunale degli Intronati'}",4,"[e-it, e-it, e-it, e-it]","[Italy, NoInfo, Italy, Italy]","[Florence, NoInfo, Florence, Siena]","[43.77925, NoInfo, 43.77925, 43.31822]","[11.24626, NoInfo, 11.24626, 11.33064]","[1481, 1481, 1614, 1758]","[1481, 1500, NoInfo, 2021]","[[15], [15], [17], [18]]",True,"[Italy, Italy, Italy, Italy]","[43.77925, 42.83333, 43.77925, 43.31822]","[11.24626, 12.83333, 11.24626, 11.33064]","[accurate, approx, accurate, accurate]",https://data.cerl.org/mei/02140784,"[accurate, accurate, accurate, accurate]","[accurate, approx, NoInfo, accurate]","[43.77925, 42.83333, 43.77925, 43.31822]","[11.24626, 12.83333, 11.24626, 11.33064]","[1481, 1481, 1614, 1758]","[1481, 1500, 1500, 2021]"
02142781,"{u'country': u'RU', u'short': u'Moscow SL', u'name': u'Moscow, [Russian State Library] Rossijskaja Gosudarstvennaja Biblioteka'}",6,"[e-it, e-it, e-gx, e-gx, e-gx, e-ru]","[Italy, Italy, Germany, Germany, Germany, Russia]","[Florence, Florence, Dresden, Dresden, Dresden, Moscow]","[43.77925, 43.77925, 51.05089, 51.05089, 51.05089, 55.75222]","[11.24626, 11.24626, 13.73832, 13.73832, 13.73832, 37.61556]","[1481, 1812, 1840, 1920, 1938, 1945]","[1481, 1829, 1920, 1938, 1945, 2021]","[[15], [19], [19, 20], [20], [20], [20]]",True,"[Italy, Italy, Germany, Germany, Germany, Russia]","[43.77925, 43.77925, 51.05089, 51.05089, 51.05089, 55.75222]","[11.24626, 11.24626, 13.73832, 13.73832, 13.73832, 37.61556]","[accurate, accurate, accurate, accurate, accurate, accurate]",https://data.cerl.org/mei/02142781,"[accurate, accurate, accurate, accurate, accurate, accurate]","[accurate, accurate, accurate, accurate, accurate, accurate]","[43.77925, 43.77925, 51.05089, 51.05089, 51.05089, 55.75222]","[11.24626, 11.24626, 13.73832, 13.73832, 13.73832, 37.61556]","[1481, 1812, 1840, 1920, 1938, 1945]","[1481, 1829, 1920, 1938, 1945, 2021]"
02141086,"{u'country': u'IT', u'short': u'Novara C', u'name': u'Novara, Biblioteca civica Carlo Negroni'}",7,"[e-it, e-it, e-it, e-it, e-gx, e-it, e-it]","[Italy, NoInfo, NoInfo, NoInfo, Germany, Italy, Italy]","[Florence, NoInfo, NoInfo, NoInfo, Munich, Novara, Novara]","[43.77925, NoInfo, NoInfo, NoInfo, 48.13743, 45.44694, 45.44694]","[11.24626, NoInfo, NoInfo, NoInfo, 11.57549, 8.62118, 8.62118]","[1481, 1481, 1481, 1601, 1800, NoInfo, 1896]","[1481, 1600, 1600, 1700, 1830, 1896, 2021]","[[15], [15, 16], [15, 16], [17], [18, 19], [15, 16, 17, 18, 19], [19]]",True,"[Italy, Italy, Italy, Italy, Germany, Italy, Italy]","[43.77925, 42.83333, 42.83333, 42.83333, 48.13743, 45.44694, 45.44694]","[11.24626, 12.83333, 12.83333, 12.83333, 11.57549, 8.62118, 8.62118]","[accurate, approx, approx, approx, accurate, accurate, accurate]",https://data.cerl.org/mei/02141086,"[accurate, accurate, accurate, accurate, approx, NoInfo, accurate]","[accurate, approx, approx, approx, accurate, accurate, accurate]","[43.77925, 42.83333, 42.83333, 42.83333, 48.13743, 45.44694, 45.44694]","[11.24626, 12.83333, 12.83333, 12.83333, 11.57549, 8.62118, 8.62118]","[1481, 1481, 1481, 1601, 1800, 1800, 1896]","[1481, 1600, 1600, 1700, 1830, 1896, 2021]"
02141148,"{u'country': u'GB', u'short': u'Chatsworth Library', u'name': u'Chatsworth, Devonshire Collection, Library'}",6,"[e-it, e, e, e, e-uk-en, e-uk]","[Italy, NoInfo, NoInfo, NoInfo, United Kingdom, United Kingdom]","[Florence, Europe, NoInfo, NoInfo, Edensor, Chatsworth House]","[43.77925, 48.69096, NoInfo, NoInfo, 53.22662, 53.21667]","[11.24626, 9.14062, NoInfo, NoInfo, -1.62576, -1.6]","[1481, 1501, 1701, 1701, 1811, 1844]","[1481, 1600, 1800, 1800, 1844, 2021]","[[15], [16], [18], [18], [19], [19]]",True,"[Italy, NoInfo, Japan, Japan, United Kingdom, United Kingdom]","[43.77925, 48.69096, 35.68536, 35.68536, 53.22662, 53.21667]","[11.24626, 9.14062, 139.75309, 139.75309, -1.62576, -1.6]","[accurate, accurate, approx, approx, accurate, accurate]",https://data.cerl.org/mei/02141148,"[accurate, accurate, accurate, accurate, accurate, accurate]","[accurate, approx, approx, approx, accurate, accurate]","[43.77925, 48.69096, 35.68536, 35.68536, 53.22662, 53.21667]","[11.24626, 9.14062, 139.75309, 139.75309, -1.62576, -1.6]","[1481, 1501, 1701, 1701, 1811, 1844]","[1481, 1600, 1800, 1800, 1844, 2021]"
02141598,"{u'country': u'DE', u'short': u'München BSB', u'name': u'München, Bayerische Staatsbibliothek', u'isil': u'DE-12'}",2,"[e-it, e-gx]","[Italy, Germany]","[Florence, Munich]","[43.77925, 48.13743]","[11.24626, 11.57549]","[1481, NoInfo]","[1481, 2021]","[[15], NoInfo]",True,"[Italy, Germany]","[43.77925, 48.13743]","[11.24626, 11.57549]","[accurate, accurate]",https://data.cerl.org/mei/02141598,"[accurate, NoInfo]","[accurate, accurate]","[43.77925, 48.13743]","[11.24626, 11.57549]","[1481, 1481]","[1481, 2021]"
02141603,"{u'country': u'CH', u'short': u'Genève, Bib. d'Italien', u'name': u'Genève, Université de Genève, Fondation Barbier-Mueller pour l’étude de la poésie de la Renaissance'}",6,"[e-it, e-it, e, NoInfo, e-it, e-sz]","[Italy, NoInfo, NoInfo, NoInfo, Italy, Switzerland]","[Florence, NoInfo, NoInfo, NoInfo, Turin, Geneva]","[43.77925, NoInfo, NoInfo, NoInfo, 45.07049, 46.20222]","[11.24626, NoInfo, NoInfo, NoInfo, 7.68682, 6.14569]","[1481, 1481, 1701, 1950, NoInfo, 2013]","[1481, 1600, 1800, 1980, 2013, 2021]","[[15], [15, 16], [18], [20], [15, 16, 17, 18, 19, 20, 21], [21]]",True,"[Italy, Italy, Japan, NoInfo, Italy, Switzerland]","[43.77925, 42.83333, 35.68536, NoInfo, 45.07049, 46.20222]","[11.24626, 12.83333, 139.75309, NoInfo, 7.68682, 6.14569]","[accurate, approx, approx, NoInfo, accurate, accurate]",https://data.cerl.org/mei/02141603,"[accurate, accurate, accurate, approx, NoInfo, accurate]","[accurate, approx, approx, accurate, accurate, accurate]","[43.77925, 42.83333, 35.68536, 35.68536, 45.07049, 46.20222]","[11.24626, 12.83333, 139.75309, 139.75309, 7.68682, 6.14569]","[1481, 1481, 1701, 1950, 1950, 2013]","[1481, 1600, 1800, 1980, 2013, 2021]"
02141143,"{u'country': u'GB', u'short': u'Cambridge, Trinity College', u'name': u'Cambridge, Trinity College'}",8,"[e-it, e-it, e-uk-en, e-uk, e-uk-en, e-uk-en, e-uk, e-uk]","[Italy, NoInfo, NoInfo, United Kingdom, United Kingdom, United Kingdom, United Kingdom, United Kingdom]","[Florence, NoInfo, NoInfo, London, London, London, Crowan, Cambridge]","[43.77925, NoInfo, NoInfo, 51.50853, 51.50853, 51.50853, 50.16782, 52.2]","[11.24626, NoInfo, NoInfo, -0.12574, -0.12574, -0.12574, -5.32303, 0.11667]","[1481, 1481, 1813, 1857, 1860, 1862, 1862, 1863]","[1481, 1500, 1857, 1857, 1860, 1862, 1863, 2021]","[[15], [15], [19], [19], [19], [19], [19], [19]]",True,"[Italy, Italy, United Kingdom, United Kingdom, United Kingdom, United Kingdom, United Kingdom, United Kingdom]","[43.77925, 42.83333, 54.75844, 51.50853, 51.50853, 51.50853, 50.16782, 52.2]","[11.24626, 12.83333, -2.69531, -0.12574, -0.12574, -0.12574, -5.32303, 0.11667]","[accurate, approx, approx, accurate, accurate, accurate, accurate, accurate]",https://data.cerl.org/mei/02141143,"[accurate, accurate, accurate, accurate, accurate, accurate, accurate, accurate]","[accurate, approx, accurate, accurate, accurate, accurate, accurate, accurate]","[43.77925, 42.83333, 54.75844, 51.50853, 51.50853, 51.50853, 50.16782, 52.2]","[11.24626, 12.83333, -2.69531, -0.12574, -0.12574, -0.12574, -5.32303, 0.11667]","[1481, 1481, 1813, 1857, 1860, 1862, 1862, 1863]","[1481, 1500, 1857, 1857, 1860, 1862, 1863, 2021]"
02140676,"{u'country': u'DE', u'short': u'Stuttgart WLB', u'name': u'Stuttgart, Württembergische Landesbibliothek', u'isil': u'DE-24'}",13,"[e-it, e-it, e-it, e-it, e-it, e-it, e-it, e-it, e-it, e-it, e-fr, e-gw, e-gx]","[Italy, NoInfo, NoInfo, NoInfo, NoInfo, NoInfo, Italy, Italy, Italy, Italy, France, Germany, Germany]","[Florence, NoInfo, NoInfo, NoInfo, NoInfo, NoInfo, Florence, Florence, Florence, Florence, Nancy, Ludwigsburg, Stuttgart]","[43.77925, NoInfo, NoInfo, NoInfo, NoInfo, NoInfo, 43.77925, 43.77925, 43.77925, 43.77925, 48.68439, 48.89731, 48.77667]","[11.24626, NoInfo, NoInfo, NoInfo, NoInfo, NoInfo, 11.24626, 11.24626, 11.24626, 11.24626, 6.18496, 9.19161, 9.1775]","[1481, 1481, 1481, 1501, 1501, 1501, 1510, 1540, 1593, 1620, 1740, NoInfo, NoInfo]","[1481, 1600, 1600, 1600, 1600, 1600, 1537, 1599, 1647, 1620, 1799, NoInfo, 2021]","[[15], [15, 16], [15, 16], [16], [16], [16], [16], [16], [16, 17], [17], [18], NoInfo, NoInfo]",True,"[Italy, Italy, Italy, Italy, Italy, Italy, Italy, Italy, Italy, Italy, France, Germany, Germany]","[43.77925, 42.83333, 42.83333, 42.83333, 42.83333, 42.83333, 43.77925, 43.77925, 43.77925, 43.77925, 48.68439, 48.89731, 48.77667]","[11.24626, 12.83333, 12.83333, 12.83333, 12.83333, 12.83333, 11.24626, 11.24626, 11.24626, 11.24626, 6.18496, 9.19161, 9.1775]","[accurate, approx, approx, approx, approx, approx, accurate, accurate, accurate, accurate, accurate, accurate, accurate]",https://data.cerl.org/mei/02140676,"[accurate, accurate, accurate, accurate, accurate, accurate, accurate, accurate, accurate, accurate, accurate, NoInfo, NoInfo]","[accurate, approx, approx, approx, approx, approx, accurate, accurate, accurate, accurate, accurate, NoInfo, accurate]","[43.77925, 42.83333, 42.83333, 42.83333, 42.83333, 42.83333, 43.77925, 43.77925, 43.77925, 43.77925, 48.68439, 48.89731, 48.77667]","[11.24626, 12.83333, 12.83333, 12.83333, 12.83333, 12.83333, 11.24626, 11.24626, 11.24626, 11.24626, 6.18496, 9.19161, 9.1775]","[1481, 1481, 1481, 1501, 1501, 1501, 1510, 1540, 1593, 1620, 1740, 1740, 1740]","[1481, 1600, 1600, 1600, 1600, 1600, 1537, 1599, 1647, 1620, 1799, 1799, 2021]"
02142772,"{u'country': u'BL', u'short': u'Rio de Janeiro', u'name': u'Rio de Janeiro, Casa de Rui Barbosa Foundation'}",7,"[e-it, NoInfo, e-it, e-it, e, s-bl, s-bl]","[Italy, NoInfo, NoInfo, Italy, NoInfo, Brazil, Brazil]","[Florence, NoInfo, NoInfo, Florence, NoInfo, Rio de Janeiro, Rio de Janeiro]","[43.77925, NoInfo, NoInfo, 43.77925, NoInfo, -22.90642, -22.90642]","[11.24626, NoInfo, NoInfo, 11.24626, NoInfo, -43.18223, -43.18223]","[1481, 1501, 1668, 1701, 1701, 1849, 1928]","[1481, 1600, 1668, 1800, 1800, 1923, 2021]","[[15], [16], [17], [18], [18], [19, 20], [20]]",True,"[Italy, NoInfo, Italy, Italy, Japan, Brazil, Brazil]","[43.77925, NoInfo, 42.83333, 43.77925, 35.68536, -22.90642, -22.90642]","[11.24626, NoInfo, 12.83333, 11.24626, 139.75309, -43.18223, -43.18223]","[accurate, NoInfo, approx, accurate, approx, accurate, accurate]",https://data.cerl.org/mei/02142772,"[accurate, accurate, accurate, accurate, accurate, accurate, accurate]","[accurate, approx, accurate, approx, approx, accurate, accurate]","[43.77925, 43.77925, 42.83333, 43.77925, 35.68536, -22.90642, -22.90642]","[11.24626, 11.24626, 12.83333, 11.24626, 139.75309, -43.18223, -43.18223]","[1481, 1501, 1668, 1701, 1701, 1849, 1928]","[1481, 1600, 1668, 1800, 1800, 1923, 2021]"
02001010,"{u'country': u'GB', u'short': u'London BL', u'name': u'London, British Library', u'isil': u'GB-Uk'}",4,"[e-it, e-uk-en, e-uk, e-uk]","[Italy, NoInfo, United Kingdom, United Kingdom]","[Florence, NoInfo, London, London]","[43.77925, NoInfo, 51.50853, 51.50853]","[11.24626, NoInfo, -0.12574, -0.12574]","[1481, 1700, 1790, 1799]","[1481, 1800, 1799, 2021]","[[15], [17, 18], [18], [18]]",True,"[Italy, United Kingdom, United Kingdom, United Kingdom]","[43.77925, 54.75844, 51.50853, 51.50853]","[11.24626, -2.69531, -0.12574, -0.12574]","[accurate, approx, accurate, accurate]",https://data.cerl.org/mei/02001010,"[accurate, approx, accurate, accurate]","[accurate, approx, accurate, accurate]","[43.77925, 54.75844, 51.50853, 51.50853]","[11.24626, -2.69531, -0.12574, -0.12574]","[1481, 1700, 1790, 1799]","[1481, 1800, 1799, 2021]"
02142777,"{u'country': u'RU', u'short': u'Moscow SL', u'name': u'Moscow, [Russian State Library] Rossijskaja Gosudarstvennaja Biblioteka'}",3,"[e-it, e-gx, e-ru]","[Italy, Germany, Russia]","[Florence, Dresden, Moscow]","[43.77925, 51.05089, 55.75222]","[11.24626, 13.73832, 37.61556]","[1481, 1556, 1945]","[1481, 1945, 2021]","[[15], [16, 17, 18, 19, 20], [20]]",True,"[Italy, Germany, Russia]","[43.77925, 51.05089, 55.75222]","[11.24626, 13.73832, 37.61556]","[accurate, accurate, accurate]",https://data.cerl.org/mei/02142777,"[accurate, accurate, accurate]","[accurate, accurate, accurate]","[43.77925, 51.05089, 55.75222]","[11.24626, 13.73832, 37.61556]","[1481, 1556, 1945]","[1481, 1945, 2021]"
00559810,"{u'country': u'GB', u'short': u'Cambridge UL', u'name': u'Cambridge, University Library'}",6,"[e-it, e-it, e-uk, e-uk, e-uk, e-uk-en]","[Italy, NoInfo, United Kingdom, United Kingdom, NoInfo, United Kingdom]","[Florence, NoInfo, Kew, London, NoInfo, Cambridge]","[43.77925, NoInfo, 51.48165, 51.50853, NoInfo, 52.2]","[11.24626, NoInfo, -0.28749, -0.12574, NoInfo, 0.11667]","[1481, 1481, 1728, 1805, 1844, 1910]","[1481, 1700, 1805, 1835, 1910, 2021]","[[15], [15, 16, 17], [18, 19], [19], [19, 20], [20]]",True,"[Italy, Italy, United Kingdom, United Kingdom, United Kingdom, United Kingdom]","[43.77925, 42.83333, 51.48165, 51.50853, 54.75844, 52.2]","[11.24626, 12.83333, -0.28749, -0.12574, -2.69531, 0.11667]","[accurate, approx, accurate, accurate, approx, accurate]",https://data.cerl.org/mei/00559810,"[accurate, accurate, accurate, accurate, accurate, accurate]","[accurate, approx, accurate, accurate, accurate, accurate]","[43.77925, 42.83333, 51.48165, 51.50853, 54.75844, 52.2]","[11.24626, 12.83333, -0.28749, -0.12574, -2.69531, 0.11667]","[1481, 1481, 1728, 1805, 1844, 1910]","[1481, 1700, 1805, 1835, 1910, 2021]"
02140828,"{u'country': u'RU', u'short': u'Moscow SL', u'name': u'Moscow, [Russian State Library] Rossijskaja Gosudarstvennaja Biblioteka'}",5,"[e-it, NoInfo, e-gx, e-gx, e-ru]","[Italy, NoInfo, Germany, Germany, Russia]","[Florence, NoInfo, Dresden, Leipzig, Moscow]","[43.77925, NoInfo, 51.05089, 51.33962, 55.75222]","[11.24626, NoInfo, 13.73832, 12.37129, 37.61556]","[1481, NoInfo, 1819, 1886, 1945]","[1481, NoInfo, 1886, 1945, 2021]","[[15], NoInfo, [19], [19, 20], [20]]",True,"[Italy, NoInfo, Germany, Germany, Russia]","[43.77925, NoInfo, 51.05089, 51.33962, 55.75222]","[11.24626, NoInfo, 13.73832, 12.37129, 37.61556]","[accurate, NoInfo, accurate, accurate, accurate]",https://data.cerl.org/mei/02140828,"[accurate, NoInfo, accurate, accurate, accurate]","[accurate, NoInfo, accurate, accurate, accurate]","[43.77925, 43.77925, 51.05089, 51.33962, 55.75222]","[11.24626, 11.24626, 13.73832, 12.37129, 37.61556]","[1481, 1481, 1819, 1886, 1945]","[1481, 1481, 1886, 1945, 2021]"
02140829,"{u'country': u'RU', u'short': u'Moscow SL', u'name': u'Moscow, [Russian State Library] Rossijskaja Gosudarstvennaja Biblioteka'}",4,"[e-it, e-ru, e-ru, e-ru]","[Italy, Russia, Russia, Russia]","[Florence, St Petersburg, Moscow, Moscow]","[43.77925, 59.93863, 55.75222, 55.75222]","[11.24626, 30.31413, 37.61556, 37.61556]","[1481, 1820, 1869, 1924]","[1481, 1869, 1924, 2021]","[[15], [19], [19, 20], [20]]",True,"[Italy, Russia, Russia, Russia]","[43.77925, 59.93863, 55.75222, 55.75222]","[11.24626, 30.31413, 37.61556, 37.61556]","[accurate, accurate, accurate, accurate]",https://data.cerl.org/mei/02140829,"[accurate, accurate, accurate, accurate]","[accurate, accurate, accurate, accurate]","[43.77925, 59.93863, 55.75222, 55.75222]","[11.24626, 30.31413, 37.61556, 37.61556]","[1481, 1820, 1869, 1924]","[1481, 1869, 1924, 2021]"
02141491,"{u'country': u'US', u'short': u'Mills College', u'name': u'Mills College'}",6,"[e-it, e-it, e-it, e-uk-en, n-us-ca, n-us-ca]","[Italy, NoInfo, Italy, United Kingdom, United States, United States]","[Florence, NoInfo, Chiusa di Pesio, London, Oakland, Oakland]","[43.77925, NoInfo, 44.32588, 51.50853, 37.80437, 37.80437]","[11.24626, NoInfo, 7.67431, -0.12574, -122.2708, -122.2708]","[1481, 1481, 1650, 1841, 1877, 1948]","[1481, 1500, 1650, 1883, 1948, 2021]","[[15], [15], [17], [19], [19, 20], [20]]",True,"[Italy, Italy, Italy, United Kingdom, United States, United States]","[43.77925, 42.83333, 44.32588, 51.50853, 37.80437, 37.80437]","[11.24626, 12.83333, 7.67431, -0.12574, -122.2708, -122.2708]","[accurate, approx, accurate, accurate, accurate, accurate]",https://data.cerl.org/mei/02141491,"[accurate, accurate, approx, accurate, accurate, accurate]","[accurate, approx, approx, accurate, accurate, accurate]","[43.77925, 42.83333, 44.32588, 51.50853, 37.80437, 37.80437]","[11.24626, 12.83333, 7.67431, -0.12574, -122.2708, -122.2708]","[1481, 1481, 1650, 1841, 1877, 1948]","[1481, 1500, 1650, 1883, 1948, 2021]"
02142782,"{u'country': u'GB', u'short': u'London, British Museum, Department of Prints & Drawings', u'name': u'London, British Museum, Department of Prints & Drawings'}",3,"[e-it, e-uk-en, e-uk-en]","[Italy, United Kingdom, United Kingdom]","[Florence, London, London]","[43.77925, 51.50853, 51.50853]","[11.24626, -0.12574, -0.12574]","[1481, 1835, 1845]","[1481, 1845, 2021]","[[15], [19], [19]]",True,"[Italy, United Kingdom, United Kingdom]","[43.77925, 51.50853, 51.50853]","[11.24626, -0.12574, -0.12574]","[accurate, accurate, accurate]",https://data.cerl.org/mei/02142782,"[accurate, accurate, accurate]","[accurate, accurate, accurate]","[43.77925, 51.50853, 51.50853]","[11.24626, -0.12574, -0.12574]","[1481, 1835, 1845]","[1481, 1845, 2021]"
02141147,"{u'country': u'GB', u'short': u'Cambridge, Trinity College', u'name': u'Cambridge, Trinity College'}",4,"[e-it, e-it, e-uk, e-uk]","[Italy, Italy, United Kingdom, United Kingdom]","[Florence, Florence, London, Cambridge]","[43.77925, 43.77925, 51.50853, 52.2]","[11.24626, 11.24626, -0.12574, 0.11667]","[1481, 1554, 1645, NoInfo]","[1481, 1571, 1645, 2021]","[[15], [16], [17], NoInfo]",True,"[Italy, Italy, United Kingdom, United Kingdom]","[43.77925, 43.77925, 51.50853, 52.2]","[11.24626, 11.24626, -0.12574, 0.11667]","[accurate, accurate, accurate, accurate]",https://data.cerl.org/mei/02141147,"[accurate, accurate, accurate, NoInfo]","[accurate, accurate, accurate, accurate]","[43.77925, 43.77925, 51.50853, 52.2]","[11.24626, 11.24626, -0.12574, 0.11667]","[1481, 1554, 1645, 1645]","[1481, 1571, 1645, 2021]"
02140991,"{u'country': u'FR', u'short': u'Tours BM', u'name': u'Tours, Bibliothèque Municipale'}",6,"[e-it, e-it, e-it, e-uk, e-fr, e-fr]","[Italy, NoInfo, Italy, NoInfo, France, France]","[Florence, NoInfo, Naples, NoInfo, Tours, Tours]","[43.77925, NoInfo, 40.85216, NoInfo, 47.39484, 47.39484]","[11.24626, NoInfo, 14.26811, NoInfo, 0.70398, 0.70398]","[1481, 1481, NoInfo, 1781, NoInfo, 1972]","[1481, 1600, NoInfo, 1833, 1972, 2021]","[[15], [15, 16], NoInfo, [18, 19], [15, 16, 17, 18, 19, 20], [20]]",True,"[Italy, Italy, Italy, United Kingdom, France, France]","[43.77925, 42.83333, 40.85216, 54.75844, 47.39484, 47.39484]","[11.24626, 12.83333, 14.26811, -2.69531, 0.70398, 0.70398]","[accurate, approx, accurate, approx, accurate, accurate]",https://data.cerl.org/mei/02140991,"[accurate, accurate, NoInfo, accurate, NoInfo, accurate]","[accurate, approx, NoInfo, accurate, accurate, accurate]","[43.77925, 42.83333, 40.85216, 54.75844, 47.39484, 47.39484]","[11.24626, 12.83333, 14.26811, -2.69531, 0.70398, 0.70398]","[1481, 1481, 1481, 1781, 1781, 1972]","[1481, 1600, 1600, 1833, 1972, 2021]"
02138497,"{u'country': u'NL', u'short': u'The Hague MMW', u'name': u'The Hague, Museum Meermanno-Westreenianum '}",4,"[e-it, NoInfo, e-ne, e-ne]","[Italy, NoInfo, Netherlands, Netherlands]","[Florence, NoInfo, Gemeente Den Haag, Gemeente Den Haag]","[43.77925, NoInfo, 52.06866, 52.06866]","[11.24626, NoInfo, 4.28635, 4.28635]","[1481, 1501, 1824, NoInfo]","[1481, 1600, 1848, 2021]","[[15], [16], [19], NoInfo]",True,"[Italy, NoInfo, Netherlands, Netherlands]","[43.77925, NoInfo, 52.06866, 52.06866]","[11.24626, NoInfo, 4.28635, 4.28635]","[accurate, NoInfo, accurate, accurate]",https://data.cerl.org/mei/02138497,"[accurate, accurate, accurate, NoInfo]","[accurate, approx, accurate, accurate]","[43.77925, 43.77925, 52.06866, 52.06866]","[11.24626, 11.24626, 4.28635, 4.28635]","[1481, 1501, 1824, 1824]","[1481, 1600, 1848, 2021]"
02129250,"{u'country': u'US', u'short': u'San Marino CA, Huntington Library', u'name': u'San Marino CA, Huntington Library'}",9,"[e-it, e-it, en, e-uk-en, e-uk-en, e-uk-en, e-uk-en, n-us-ca, n-us-ca]","[Italy, NoInfo, NoInfo, United Kingdom, United Kingdom, United Kingdom, United Kingdom, United States, United States]","[Florence, NoInfo, NoInfo, London, Fosbury, London, London, San Marino, San Marino]","[43.77925, NoInfo, NoInfo, 51.50853, 51.32029, 51.50853, 51.50853, 34.1214, 34.1214]","[11.24626, NoInfo, NoInfo, -0.12574, -1.54255, -0.12574, -0.12574, -118.10646, -118.10646]","[1481, 1481, 1800, 1849, 1878, 1912, 1912, 1918, 1927]","[1481, 1500, 1848, 1878, 1910, 1912, NoInfo, 1927, 2021]","[[15], [15], [18, 19], [19], [19, 20], [20], [20], [20], [20]]",True,"[Italy, Italy, United Kingdom, United Kingdom, United Kingdom, United Kingdom, United Kingdom, United States, United States]","[43.77925, 42.83333, 54.75844, 51.50853, 51.32029, 51.50853, 51.50853, 34.1214, 34.1214]","[11.24626, 12.83333, -2.69531, -0.12574, -1.54255, -0.12574, -0.12574, -118.10646, -118.10646]","[accurate, approx, approx, accurate, accurate, accurate, accurate, accurate, accurate]",https://data.cerl.org/mei/02129250,"[accurate, accurate, approx, accurate, accurate, accurate, accurate, accurate, accurate]","[accurate, approx, accurate, accurate, accurate, accurate, NoInfo, accurate, accurate]","[43.77925, 42.83333, 54.75844, 51.50853, 51.32029, 51.50853, 51.50853, 34.1214, 34.1214]","[11.24626, 12.83333, -2.69531, -0.12574, -1.54255, -0.12574, -0.12574, -118.10646, -118.10646]","[1481, 1481, 1800, 1849, 1878, 1912, 1912, 1918, 1927]","[1481, 1500, 1848, 1878, 1910, 1912, 1912, 1927, 2021]"
02141115,"{u'country': u'PL', u'short': u'Wroclaw, Ossolineum', u'name': u'Wrocław, Ossolineum'}",5,"[e-it, NoInfo, e-un, e-un, e-pl]","[Italy, NoInfo, Ukraine, Ukraine, Poland]","[Florence, NoInfo, Lviv, Lviv, Wroclaw]","[43.77925, NoInfo, 49.83826, 49.83826, 51.1]","[11.24626, NoInfo, 24.02324, 24.02324, 17.03333]","[1481, NoInfo, NoInfo, 1853, 1946]","[1481, NoInfo, 1853, 1946, 2021]","[[15], NoInfo, [15, 16, 17, 18, 19], [19, 20], [20]]",True,"[Italy, NoInfo, Ukraine, Ukraine, Poland]","[43.77925, NoInfo, 49.83826, 49.83826, 51.1]","[11.24626, NoInfo, 24.02324, 24.02324, 17.03333]","[accurate, NoInfo, accurate, accurate, accurate]",https://data.cerl.org/mei/02141115,"[accurate, NoInfo, NoInfo, accurate, accurate]","[accurate, NoInfo, accurate, accurate, accurate]","[43.77925, 43.77925, 49.83826, 49.83826, 51.1]","[11.24626, 11.24626, 24.02324, 24.02324, 17.03333]","[1481, 1481, 1481, 1853, 1946]","[1481, 1481, 1853, 1946, 2021]"
