Id,holdingInstitution,NumOfProv,areaCode,placeCountry,placeName,placeLat,placeLon,timeStart,timeEnd,timeCentury,Today,locationName,locationLat,locationLon,locationType,MEIlink,startType,endType,locationLatFilled,locationLonFilled,timeStartFilled,timeEndFilled
02141263,"{u'country': u'US', u'short': u'Harvard Houghton', u'name': u'Cambridge MA, Harvard Library, Houghton Library'}",8,"[e-it, e-it, e-uk-en, e-uk-en, e-uk, e-uk, n-us-ma, n-us-ma]","[Italy, NoInfo, United Kingdom, NoInfo, NoInfo, United Kingdom, United States, United States]","[Florence, NoInfo, London, NoInfo, NoInfo, London, Boston, Cambridge]","[43.77925, NoInfo, 51.50853, NoInfo, NoInfo, 51.50853, 42.35843, 42.3751]","[11.24626, NoInfo, -0.12574, NoInfo, NoInfo, -0.12574, -71.05977, -71.10561]","[1481, 1481, 1810, 1845, 1845, 1868, 1875, 1919]","[1481, 1700, 1843, 1845, 1868, 1875, 1919, 2021]","[[15], [15, 16, 17], [19], [19], [19], [19], [19, 20], [20]]",True,"[Italy, Italy, United Kingdom, United Kingdom, United Kingdom, United Kingdom, United States, United States]","[43.77925, 42.83333, 51.50853, 54.75844, 54.75844, 51.50853, 42.35843, 42.3751]","[11.24626, 12.83333, -0.12574, -2.69531, -2.69531, -0.12574, -71.05977, -71.10561]","[accurate, approx, accurate, approx, approx, accurate, accurate, accurate]",https://data.cerl.org/mei/02141263,"[accurate, accurate, accurate, accurate, accurate, accurate, accurate, accurate]","[accurate, approx, accurate, accurate, accurate, accurate, accurate, accurate]","[43.77925, 42.83333, 51.50853, 54.75844, 54.75844, 51.50853, 42.35843, 42.3751]","[11.24626, 12.83333, -0.12574, -2.69531, -2.69531, -0.12574, -71.05977, -71.10561]","[1481, 1481, 1810, 1845, 1845, 1868, 1875, 1919]","[1481, 1700, 1843, 1845, 1868, 1875, 1919, 2021]"
02141270,"{u'country': u'US', u'short': u'The Newberry Library', u'name': u'The Newberry Library'}",4,"[e-it, NoInfo, n-us-oh, n-us-il]","[Italy, NoInfo, United States, United States]","[Florence, NoInfo, Cincinnati, Chicago]","[43.77925, NoInfo, 39.12711, 41.85003]","[11.24626, NoInfo, -84.51439, -87.65005]","[1481, 1701, 1820, 1890]","[1481, 1800, 1890, 2021]","[[15], [18], [19], [19]]",True,"[Italy, NoInfo, United States, United States]","[43.77925, NoInfo, 39.12711, 41.85003]","[11.24626, NoInfo, -84.51439, -87.65005]","[accurate, NoInfo, accurate, accurate]",https://data.cerl.org/mei/02141270,"[accurate, accurate, accurate, accurate]","[accurate, approx, accurate, accurate]","[43.77925, 43.77925, 39.12711, 41.85003]","[11.24626, 11.24626, -84.51439, -87.65005]","[1481, 1701, 1820, 1890]","[1481, 1800, 1890, 2021]"
02140994,"{u'country': u'DE', u'short': u'Hamburg Kunsthalle', u'name': u'Hamburg, Bibliothek der Hamburger Kunsthalle'}",4,"[e-it, e-fr, e-gx, e-gx]","[Italy, France, Germany, Germany]","[Florence, Paris, Hamburg, Hamburg]","[43.77925, 48.85341, 53.55073, 53.55073]","[11.24626, 2.3488, 9.99302, 9.99302]","[1481, 1731, NoInfo, 1863]","[1481, 1788, 1863, 2021]","[[15], [18], [15, 16, 17, 18, 19], [19]]",True,"[Italy, France, Germany, Germany]","[43.77925, 48.85341, 53.55073, 53.55073]","[11.24626, 2.3488, 9.99302, 9.99302]","[accurate, accurate, accurate, accurate]",https://data.cerl.org/mei/02140994,"[accurate, accurate, NoInfo, accurate]","[accurate, accurate, accurate, accurate]","[43.77925, 48.85341, 53.55073, 53.55073]","[11.24626, 2.3488, 9.99302, 9.99302]","[1481, 1731, 1731, 1863]","[1481, 1788, 1863, 2021]"
02141186,"{u'country': u'GB', u'short': u'Manchester JRL', u'name': u'Manchester, John Rylands University Library'}",8,"[e-it, e-it, e-it, e-it, e-uk-en, e-uk, e-uk, e-uk]","[Italy, NoInfo, Italy, NoInfo, United Kingdom, NoInfo, United Kingdom, United Kingdom]","[Florence, NoInfo, Florence, NoInfo, Althorp, None, Manchester, Manchester]","[43.77925, NoInfo, 43.77925, NoInfo, 52.28107, NoInfo, 53.48095, 53.48095]","[11.24626, NoInfo, 11.24626, NoInfo, -1.00095, NoInfo, -2.23743, -2.23743]","[1481, 1481, 1481, 1501, 1807, 1835, 1892, 1892]","[1481, 1500, NoInfo, 1600, 1834, 1892, 1892, 2021]","[[15], [15], [15], [16], [19], [19], [19], [19]]",True,"[Italy, Italy, Italy, Italy, United Kingdom, NoInfo, United Kingdom, United Kingdom]","[43.77925, 42.83333, 43.77925, 42.83333, 52.28107, NoInfo, 53.48095, 53.48095]","[11.24626, 12.83333, 11.24626, 12.83333, -1.00095, NoInfo, -2.23743, -2.23743]","[accurate, approx, accurate, approx, accurate, accurate, accurate, accurate]",https://data.cerl.org/mei/02141186,"[accurate, accurate, accurate, accurate, accurate, accurate, accurate, accurate]","[accurate, approx, NoInfo, approx, accurate, accurate, accurate, accurate]","[43.77925, 42.83333, 43.77925, 42.83333, 52.28107, 52.28107, 53.48095, 53.48095]","[11.24626, 12.83333, 11.24626, 12.83333, -1.00095, -1.00095, -2.23743, -2.23743]","[1481, 1481, 1481, 1501, 1807, 1835, 1892, 1892]","[1481, 1500, 1500, 1600, 1834, 1892, 1892, 2021]"
02141489,"{u'country': u'US', u'short': u'Washington LoC', u'name': u'Washington DC, Library of Congress, Lessing J. Rosenwald Collection'}",5,"[e-it, e-uk-en, n-us-ny, n-us-pa, n-us-dc]","[Italy, United Kingdom, United States, United States, United States]","[Florence, London, New York, Jenkintown, Washington]","[43.77925, 51.50853, 40.71427, 40.09594, 38.89511]","[11.24626, -0.12574, -74.00597, -75.12517, -77.03637]","[1481, 1860, NoInfo, 1935, 1943]","[1481, 1927, 1935, 1943, 2021]","[[15], [19, 20], [15, 16, 17, 18, 19, 20], [20], [20]]",True,"[Italy, United Kingdom, United States, United States, United States]","[43.77925, 51.50853, 40.71427, 40.09594, 38.89511]","[11.24626, -0.12574, -74.00597, -75.12517, -77.03637]","[accurate, accurate, accurate, accurate, accurate]",https://data.cerl.org/mei/02141489,"[accurate, accurate, NoInfo, accurate, accurate]","[accurate, accurate, accurate, accurate, accurate]","[43.77925, 51.50853, 40.71427, 40.09594, 38.89511]","[11.24626, -0.12574, -74.00597, -75.12517, -77.03637]","[1481, 1860, 1860, 1935, 1943]","[1481, 1927, 1935, 1943, 2021]"
02140943,"{u'country': u'BE', u'short': u'Liège, BU', u'name': u'Liège, Bibliothèque de l'Université'}",2,"[e-it, e-fr]","[Italy, Belgium]","[Florence, Liège]","[43.77925, 50.63373]","[11.24626, 5.56749]","[1481, 1817]","[1481, 2021]","[[15], [19]]",True,"[Italy, Belgium]","[43.77925, 50.63373]","[11.24626, 5.56749]","[accurate, accurate]",https://data.cerl.org/mei/02140943,"[accurate, accurate]","[accurate, accurate]","[43.77925, 50.63373]","[11.24626, 5.56749]","[1481, 1817]","[1481, 2021]"
02140632,"{u'country': u'FR', u'short': u'Paris BN', u'name': u'Paris, Bibliothèque nationale de France'}",5,"[e-it, e-it, e-it, e-fr, e-fr]","[Italy, NoInfo, Italy, France, France]","[Florence, NoInfo, Rome, Paris, Paris]","[43.77925, NoInfo, 41.89193, 48.85341, 48.85341]","[11.24626, NoInfo, 12.51133, 2.3488, 2.3488]","[1481, 1500, 1733, 1788, 1792]","[1481, NoInfo, 1783, 1792, 2021]","[[15], [15], [18], [18], [18]]",True,"[Italy, Italy, Italy, France, France]","[43.77925, 42.83333, 41.89193, 48.85341, 48.85341]","[11.24626, 12.83333, 12.51133, 2.3488, 2.3488]","[accurate, approx, accurate, accurate, accurate]",https://data.cerl.org/mei/02140632,"[accurate, approx, accurate, accurate, accurate]","[accurate, NoInfo, accurate, accurate, accurate]","[43.77925, 42.83333, 41.89193, 48.85341, 48.85341]","[11.24626, 12.83333, 12.51133, 2.3488, 2.3488]","[1481, 1500, 1733, 1788, 1792]","[1481, 1481, 1783, 1792, 2021]"
02141738,"{u'country': u'FR', u'short': u'Paris BN', u'name': u'Paris, Bibliothèque nationale de France'}",4,"[e-it, e-fr, e-fr, e-fr]","[Italy, France, France, France]","[Florence, Paris, Paris, Paris]","[43.77925, 48.85341, 48.85341, 48.85341]","[11.24626, 2.3488, 2.3488, 2.3488]","[1481, NoInfo, 1838, 1838]","[1481, 1838, 1838, 2021]","[[15], [15, 16, 17, 18, 19], [19], [19]]",True,"[Italy, France, France, France]","[43.77925, 48.85341, 48.85341, 48.85341]","[11.24626, 2.3488, 2.3488, 2.3488]","[accurate, accurate, accurate, accurate]",https://data.cerl.org/mei/02141738,"[accurate, NoInfo, accurate, accurate]","[accurate, accurate, accurate, accurate]","[43.77925, 48.85341, 48.85341, 48.85341]","[11.24626, 2.3488, 2.3488, 2.3488]","[1481, 1481, 1838, 1838]","[1481, 1838, 1838, 2021]"
02141737,"{u'country': u'FR', u'short': u'Paris BN', u'name': u'Paris, Bibliothèque nationale de France'}",3,"[e-it, e-fr, e-fr]","[Italy, France, France]","[Florence, Paris, Paris]","[43.77925, 48.85341, 48.85341]","[11.24626, 2.3488, 2.3488]","[1481, NoInfo, 1784]","[1481, 1784, 2021]","[[15], [15, 16, 17, 18], [18]]",True,"[Italy, France, France]","[43.77925, 48.85341, 48.85341]","[11.24626, 2.3488, 2.3488]","[accurate, accurate, accurate]",https://data.cerl.org/mei/02141737,"[accurate, NoInfo, accurate]","[accurate, accurate, accurate]","[43.77925, 48.85341, 48.85341]","[11.24626, 2.3488, 2.3488]","[1481, 1481, 1784]","[1481, 1784, 2021]"
02141741,"{u'country': u'DE', u'short': u'Gutenberg-Museum', u'name': u'Gutenberg-Museum'}",1,[e-it],[Italy],[Florence],[43.77925],[11.24626],[1481],[1481],[[15]],False,[Italy],[43.77925],[11.24626],[accurate],https://data.cerl.org/mei/02141741,[accurate],[accurate],[43.77925],[11.24626],[1481],[1481]
02001008,"{u'country': u'GB', u'isil': u'GB-Uk', u'name': u'London, British Library', u'short': u'London BL'}",3,"[e-it, e-uk, e-uk]","[Italy, United Kingdom, United Kingdom]","[Florence, London, London]","[43.77925, 51.50853, 51.50853]","[11.24626, -0.12574, -0.12574]","[1481, 1755, 1847]","[1481, 1846, 2021]","[[15], [18, 19], [19]]",True,"[Italy, United Kingdom, United Kingdom]","[43.77925, 51.50853, 51.50853]","[11.24626, -0.12574, -0.12574]","[accurate, accurate, accurate]",https://data.cerl.org/mei/02001008,"[accurate, accurate, accurate]","[accurate, accurate, accurate]","[43.77925, 51.50853, 51.50853]","[11.24626, -0.12574, -0.12574]","[1481, 1755, 1847]","[1481, 1846, 2021]"
02141599,"{u'country': u'DE', u'isil': u'DE-B11k', u'name': u' Berlin, Kupferstich Kabinett', u'short': u'Berlin, Kupferstich Kabinett'}",4,"[e-it, NoInfo, e-gx, e-gx]","[Italy, NoInfo, Germany, Germany]","[Florence, NoInfo, Berlin, Berlin]","[43.77925, NoInfo, 52.52437, 52.52437]","[11.24626, NoInfo, 13.41053, 13.41053]","[1481, 1501, 1800, 1850]","[1481, 1600, 1846, 2021]","[[15], [16], [18, 19], [19]]",True,"[Italy, NoInfo, Germany, Germany]","[43.77925, NoInfo, 52.52437, 52.52437]","[11.24626, NoInfo, 13.41053, 13.41053]","[accurate, NoInfo, accurate, accurate]",https://data.cerl.org/mei/02141599,"[accurate, accurate, approx, approx]","[accurate, approx, accurate, accurate]","[43.77925, 43.77925, 52.52437, 52.52437]","[11.24626, 11.24626, 13.41053, 13.41053]","[1481, 1501, 1800, 1850]","[1481, 1600, 1846, 2021]"
02141629,"{u'country': u'DE', u'short': u'BerlinKunstB', u'name': u'Berlin, Staatl. Museen PK, Kunstbibliothek', u'isil': u'DE-B11a'}",4,"[e-it, NoInfo, e-gx, e-gx]","[Italy, NoInfo, Germany, Germany]","[Florence, NoInfo, Berlin, Berlin]","[43.77925, NoInfo, 52.52437, 52.52437]","[11.24626, NoInfo, 13.41053, 13.41053]","[1481, 1501, 1880, 1906]","[1481, 1600, 1904, 2021]","[[15], [16], [19, 20], [20]]",True,"[Italy, NoInfo, Germany, Germany]","[43.77925, NoInfo, 52.52437, 52.52437]","[11.24626, NoInfo, 13.41053, 13.41053]","[accurate, NoInfo, accurate, accurate]",https://data.cerl.org/mei/02141629,"[accurate, accurate, accurate, accurate]","[accurate, approx, accurate, accurate]","[43.77925, 43.77925, 52.52437, 52.52437]","[11.24626, 11.24626, 13.41053, 13.41053]","[1481, 1501, 1880, 1906]","[1481, 1600, 1904, 2021]"
02141643,"{u'country': u'CH', u'short': u'Genève Bodmer ', u'name': u'Cologny, Fondation Martin Bodmer'}",3,"[e-it, NoInfo, e-sz]","[Italy, NoInfo, Switzerland]","[Florence, NoInfo, Cologny]","[43.77925, NoInfo, 46.21672]","[11.24626, NoInfo, 6.18041]","[1481, 1833, 1951]","[1481, 1861, 2021]","[[15], [19], [20]]",True,"[Italy, NoInfo, Switzerland]","[43.77925, NoInfo, 46.21672]","[11.24626, NoInfo, 6.18041]","[accurate, NoInfo, accurate]",https://data.cerl.org/mei/02141643,"[accurate, accurate, accurate]","[accurate, accurate, accurate]","[43.77925, 43.77925, 46.21672]","[11.24626, 11.24626, 6.18041]","[1481, 1833, 1951]","[1481, 1861, 2021]"
02140783,"{u'country': u'IT', u'short': u'Siena C', u'name': u'Siena, Biblioteca Comunale degli Intronati'}",3,"[e-it, e-it, e-it]","[Italy, NoInfo, Italy]","[Florence, NoInfo, Siena]","[43.77925, NoInfo, 43.31822]","[11.24626, NoInfo, 11.33064]","[1481, 1481, 1758]","[1481, 1600, 2021]","[[15], [15, 16], [18]]",True,"[Italy, Italy, Italy]","[43.77925, 42.83333, 43.31822]","[11.24626, 12.83333, 11.33064]","[accurate, approx, accurate]",https://data.cerl.org/mei/02140783,"[accurate, accurate, accurate]","[accurate, approx, accurate]","[43.77925, 42.83333, 43.31822]","[11.24626, 12.83333, 11.33064]","[1481, 1481, 1758]","[1481, 1600, 2021]"
02141600,"{u'country': u'DE', u'short': u'Dresden KupferstichKab ', u'name': u'Dresden, Staatlichen Kunstsammlungen Kupferstichkabinett'}",3,"[e-it, e-gx, e-gx]","[Italy, Germany, Germany]","[Florence, Dresden, Dresden]","[43.77925, 51.05089, 51.05089]","[11.24626, 13.73832, 13.73832]","[1481, 1853, 1853]","[1481, 1865, 2021]","[[15], [19], [19]]",True,"[Italy, Germany, Germany]","[43.77925, 51.05089, 51.05089]","[11.24626, 13.73832, 13.73832]","[accurate, accurate, accurate]",https://data.cerl.org/mei/02141600,"[accurate, accurate, accurate]","[accurate, accurate, accurate]","[43.77925, 51.05089, 51.05089]","[11.24626, 13.73832, 13.73832]","[1481, 1853, 1853]","[1481, 1865, 2021]"
02141601,"{u'country': u'DE', u'short': u'Dresden KupferstichKab ', u'name': u'Dresden, Staatlichen Kunstsammlungen Kupferstichkabinett'}",2,"[e-it, e-gx]","[Italy, Germany]","[Florence, Dresden]","[43.77925, 51.05089]","[11.24626, 13.73832]","[1481, NoInfo]","[1481, 2021]","[[15], NoInfo]",True,"[Italy, Germany]","[43.77925, 51.05089]","[11.24626, 13.73832]","[accurate, accurate]",https://data.cerl.org/mei/02141601,"[accurate, NoInfo]","[accurate, accurate]","[43.77925, 51.05089]","[11.24626, 13.73832]","[1481, 1481]","[1481, 2021]"
02140795,"{u'country': u'IT', u'short': u'Treviso C', u'name': u'Treviso, Biblioteca Comunale di Borgo Cavour  '}",5,"[e-it, e-it, e-it, e-it, e-it]","[Italy, NoInfo, Italy, Italy, Italy]","[Florence, NoInfo, Trivignano, Treviso, Treviso]","[43.77925, NoInfo, 45.53197, 45.66673, 45.66673]","[11.24626, NoInfo, 12.18687, 12.2416, 12.2416]","[1481, 1501, 1701, 1737, 1810]","[1481, 1700, 1800, 1810, 2021]","[[15], [16, 17], [18], [18, 19], [19]]",True,"[Italy, Italy, Italy, Italy, Italy]","[43.77925, 42.83333, 45.53197, 45.66673, 45.66673]","[11.24626, 12.83333, 12.18687, 12.2416, 12.2416]","[accurate, approx, accurate, accurate, accurate]",https://data.cerl.org/mei/02140795,"[accurate, accurate, accurate, accurate, accurate]","[accurate, approx, approx, accurate, accurate]","[43.77925, 42.83333, 45.53197, 45.66673, 45.66673]","[11.24626, 12.83333, 12.18687, 12.2416, 12.2416]","[1481, 1501, 1701, 1737, 1810]","[1481, 1700, 1800, 1810, 2021]"
02140630,"{u'country': u'FR', u'short': u'Paris BN', u'name': u'Paris, Bibliothèque nationale de France'}",4,"[e-it, e-it, e-it, e-fr]","[Italy, Italy, Italy, France]","[Florence, Venice, Venice, Paris]","[43.77925, 45.4389, 45.4389, 48.85341]","[11.24626, 12.33092, 12.33092, 2.3488]","[1481, 1481, 1519, 1801]","[1481, 1519, 1547, 2021]","[[15], [15, 16], [16], [19]]",True,"[Italy, Italy, Italy, France]","[43.77925, 45.4389, 45.4389, 48.85341]","[11.24626, 12.33092, 12.33092, 2.3488]","[accurate, accurate, accurate, accurate]",https://data.cerl.org/mei/02140630,"[accurate, accurate, accurate, accurate]","[accurate, accurate, accurate, accurate]","[43.77925, 45.4389, 45.4389, 48.85341]","[11.24626, 12.33092, 12.33092, 2.3488]","[1481, 1481, 1519, 1801]","[1481, 1519, 1547, 2021]"
02141192,"{u'country': u'US', u'short': u'Boston Public Library', u'name': u'Boston Public Library'}",7,"[e-it, e-it, e-it, n-us-ma, n-us-ma, n-us-ma, n-us-ma]","[Italy, NoInfo, Italy, United States, United States, United States, United States]","[Florence, NoInfo, Italy, Boston, Cambridge, Cambridge, Boston]","[43.77925, NoInfo, 42.83333, 42.35843, 42.3751, 42.3751, 42.35843]","[11.24626, NoInfo, 12.83333, -71.05977, -71.10561, -71.10561, -71.05977]","[1481, 1481, 1550, 1939, 1939, 1943, 1943]","[1481, 1500, 1650, 1939, 1943, 1943, 2021]","[[15], [15], [16, 17], [20], [20], [20], [20]]",True,"[Italy, Italy, Italy, United States, United States, United States, United States]","[43.77925, 42.83333, 42.83333, 42.35843, 42.3751, 42.3751, 42.35843]","[11.24626, 12.83333, 12.83333, -71.05977, -71.10561, -71.10561, -71.05977]","[accurate, approx, accurate, accurate, accurate, accurate, accurate]",https://data.cerl.org/mei/02141192,"[accurate, accurate, approx, accurate, accurate, accurate, accurate]","[accurate, approx, approx, accurate, accurate, accurate, accurate]","[43.77925, 42.83333, 42.83333, 42.35843, 42.3751, 42.3751, 42.35843]","[11.24626, 12.83333, 12.83333, -71.05977, -71.10561, -71.10561, -71.05977]","[1481, 1481, 1550, 1939, 1939, 1943, 1943]","[1481, 1500, 1650, 1939, 1943, 1943, 2021]"
02140648,"{u'country': u'FR', u'short': u'Paris, Ste Genevieve', u'name': u'Paris, Bibliothèque de Sainte-Geneviève'}",5,"[e-it, e-it, NoInfo, e-it, e-fr]","[Italy, Italy, NoInfo, Italy, France]","[Florence, Florence, NoInfo, Rome, Paris]","[43.77925, 43.77925, NoInfo, 41.89193, 48.85341]","[11.24626, 11.24626, NoInfo, 12.51133, 2.3488]","[1481, 1481, 1500, 1717, NoInfo]","[1481, 1501, 1700, 1799, 2021]","[[15], [15, 16], [15, 16, 17], [18], NoInfo]",True,"[Italy, Italy, NoInfo, Italy, France]","[43.77925, 43.77925, NoInfo, 41.89193, 48.85341]","[11.24626, 11.24626, NoInfo, 12.51133, 2.3488]","[accurate, accurate, NoInfo, accurate, accurate]",https://data.cerl.org/mei/02140648,"[accurate, accurate, approx, accurate, NoInfo]","[accurate, accurate, approx, accurate, accurate]","[43.77925, 43.77925, 43.77925, 41.89193, 48.85341]","[11.24626, 11.24626, 11.24626, 12.51133, 2.3488]","[1481, 1481, 1500, 1717, 1717]","[1481, 1501, 1700, 1799, 2021]"
02141739,"{u'country': u'FR', u'short': u'Paris BN', u'name': u'Paris, Bibliothèque nationale de France'}",3,"[e-it, e-fr, e-fr]","[Italy, France, France]","[Florence, Marseille, Paris]","[43.77925, 43.29695, 48.85341]","[11.24626, 5.38107, 2.3488]","[1481, 1766, 1781]","[1481, 1778, 2021]","[[15], [18], [18]]",True,"[Italy, France, France]","[43.77925, 43.29695, 48.85341]","[11.24626, 5.38107, 2.3488]","[accurate, accurate, accurate]",https://data.cerl.org/mei/02141739,"[accurate, accurate, accurate]","[accurate, accurate, accurate]","[43.77925, 43.29695, 48.85341]","[11.24626, 5.38107, 2.3488]","[1481, 1766, 1781]","[1481, 1778, 2021]"
02141717,"{u'country': u'AT', u'short': u'Wien Albertina', u'name': u'Wien, Bibliothek der Graphischen Sammlung Albertina'}",2,"[e-it, e-au]","[Italy, Austria]","[Florence, Vienna]","[43.77925, 48.20849]","[11.24626, 16.37208]","[1481, 1776]","[1481, 2021]","[[15], [18]]",True,"[Italy, Austria]","[43.77925, 48.20849]","[11.24626, 16.37208]","[accurate, accurate]",https://data.cerl.org/mei/02141717,"[accurate, accurate]","[accurate, accurate]","[43.77925, 48.20849]","[11.24626, 16.37208]","[1481, 1776]","[1481, 2021]"
02141004,"{u'country': u'FR', u'short': u'Besançon BM', u'name': u'Besançon, Bibliothèque Municipale'}",3,"[e-it, e-fr, e-fr]","[Italy, France, France]","[Florence, Besançon, Besançon]","[43.77925, 47.24878, 47.24878]","[11.24626, 6.01815, 6.01815]","[1481, 1753, 1826]","[1481, 1826, 2021]","[[15], [18, 19], [19]]",True,"[Italy, France, France]","[43.77925, 47.24878, 47.24878]","[11.24626, 6.01815, 6.01815]","[accurate, accurate, accurate]",https://data.cerl.org/mei/02141004,"[accurate, accurate, accurate]","[accurate, accurate, accurate]","[43.77925, 47.24878, 47.24878]","[11.24626, 6.01815, 6.01815]","[1481, 1753, 1826]","[1481, 1826, 2021]"
02144949,"{u'country': u'US', u'short': u'New York Public Library, Rare Book Division', u'name': u'New York Public Library, Rare Book Division'}",5,"[e-it, e-it, e-fr, n-us, n-us-ny]","[Italy, NoInfo, NoInfo, United States, United States]","[Florence, NoInfo, NoInfo, New York, New York]","[43.77925, NoInfo, NoInfo, 40.71427, 40.71427]","[11.24626, NoInfo, NoInfo, -74.00597, -74.00597]","[1481, 1550, 1908, 1908, 1922]","[1481, 1650, 1908, 1944, 2021]","[[15], [16, 17], [20], [20], [20]]",True,"[Italy, Italy, France, United States, United States]","[43.77925, 42.83333, 46.0, 40.71427, 40.71427]","[11.24626, 12.83333, 2.0, -74.00597, -74.00597]","[accurate, approx, approx, accurate, accurate]",https://data.cerl.org/mei/02144949,"[accurate, approx, accurate, accurate, accurate]","[accurate, approx, accurate, accurate, accurate]","[43.77925, 42.83333, 46.0, 40.71427, 40.71427]","[11.24626, 12.83333, 2.0, -74.00597, -74.00597]","[1481, 1550, 1908, 1908, 1922]","[1481, 1650, 1908, 1944, 2021]"
02141557,"{u'country': u'US', u'short': u'Wesleyan Univ. Library', u'name': u'Wesleyan Univ. Library'}",8,"[e-it, e-it, e-it, NoInfo, e-uk-en, e-uk, e-uk-en, n-us-ct]","[Italy, Italy, Italy, NoInfo, United Kingdom, United Kingdom, United Kingdom, United States]","[Florence, Florence, Florence, NoInfo, Sudbury, London, Sonning, Middletown]","[43.77925, 43.77925, 43.77925, NoInfo, 52.0389, 51.50853, 51.47411, 41.56232]","[11.24626, 11.24626, 11.24626, NoInfo, 0.73117, -0.12574, -0.91212, -72.65065]","[1481, 1695, 1749, 1801, 1825, 1866, 1875, NoInfo]","[1481, 1758, 1803, 1900, 1866, 1919, 1937, 2021]","[[15], [17, 18], [18, 19], [19], [19], [19, 20], [19, 20], NoInfo]",True,"[Italy, Italy, Italy, NoInfo, United Kingdom, United Kingdom, United Kingdom, United States]","[43.77925, 43.77925, 43.77925, NoInfo, 52.0389, 51.50853, 51.47411, 41.56232]","[11.24626, 11.24626, 11.24626, NoInfo, 0.73117, -0.12574, -0.91212, -72.65065]","[accurate, accurate, accurate, NoInfo, accurate, accurate, accurate, accurate]",https://data.cerl.org/mei/02141557,"[accurate, accurate, accurate, accurate, accurate, accurate, accurate, NoInfo]","[accurate, accurate, accurate, approx, accurate, accurate, accurate, accurate]","[43.77925, 43.77925, 43.77925, 43.77925, 52.0389, 51.50853, 51.47411, 41.56232]","[11.24626, 11.24626, 11.24626, 11.24626, 0.73117, -0.12574, -0.91212, -72.65065]","[1481, 1695, 1749, 1801, 1825, 1866, 1875, 1875]","[1481, 1758, 1803, 1900, 1866, 1919, 1937, 2021]"
02144952,"{u'country': u'IT', u'short': u'Milano Lucchini', u'name': u'Milano, Collezione Stefano Lucchini'}",4,"[e-it, e-fr, e-it, e-it]","[Italy, France, Italy, Italy]","[Florence, Paris, Rome, Milan]","[43.77925, 48.85341, 41.89193, 45.46427]","[11.24626, 2.3488, 12.51133, 9.18951]","[1481, 1844, 2007, 2007]","[1481, 1884, NoInfo, 2021]","[[15], [19], [21], [21]]",True,"[Italy, France, Italy, Italy]","[43.77925, 48.85341, 41.89193, 45.46427]","[11.24626, 2.3488, 12.51133, 9.18951]","[accurate, accurate, accurate, accurate]",https://data.cerl.org/mei/02144952,"[accurate, accurate, accurate, accurate]","[accurate, accurate, NoInfo, accurate]","[43.77925, 48.85341, 41.89193, 45.46427]","[11.24626, 2.3488, 12.51133, 9.18951]","[1481, 1844, 2007, 2007]","[1481, 1884, 1884, 2021]"
02141558,"{u'country': u'US', u'isil': u'US-ctybr', u'name': u'New Haven CT, Yale University, Beinecke Library', u'short': u'New Haven CT, Yale Univ., Beinecke Library'}",2,"[e-it, n-us-ct]","[Italy, United States]","[Florence, New Haven]","[43.77925, 41.30815]","[11.24626, -72.92816]","[1481, 1963]","[1481, 2021]","[[15], [20]]",True,"[Italy, United States]","[43.77925, 41.30815]","[11.24626, -72.92816]","[accurate, accurate]",https://data.cerl.org/mei/02141558,"[accurate, accurate]","[accurate, accurate]","[43.77925, 41.30815]","[11.24626, -72.92816]","[1481, 1963]","[1481, 2021]"
02141439,"{u'country': u'US', u'short': u'Cornell Univ. Libraries', u'name': u'Cornell Univ. Libraries'}",2,"[e-it, n-us-ny]","[Italy, United States]","[Florence, Ithaca]","[43.77925, 42.44063]","[11.24626, -76.49661]","[1481, 1865]","[1481, 2021]","[[15], [19]]",True,"[Italy, United States]","[43.77925, 42.44063]","[11.24626, -76.49661]","[accurate, accurate]",https://data.cerl.org/mei/02141439,"[accurate, accurate]","[accurate, accurate]","[43.77925, 42.44063]","[11.24626, -76.49661]","[1481, 1865]","[1481, 2021]"
02141267,"{u'country': u'US', u'short': u'Claremont Colleges, Honnold Library (Bodman Coll.)', u'name': u'Claremont Colleges, Honnold Library (Bodman Coll.)'}",2,"[e-it, n-us-ca]","[Italy, United States]","[Florence, Claremont]","[43.77925, 34.09668]","[11.24626, -117.71978]","[1481, 1927]","[1481, 2021]","[[15], [20]]",True,"[Italy, United States]","[43.77925, 34.09668]","[11.24626, -117.71978]","[accurate, accurate]",https://data.cerl.org/mei/02141267,"[accurate, accurate]","[accurate, accurate]","[43.77925, 34.09668]","[11.24626, -117.71978]","[1481, 1927]","[1481, 2021]"
02141440,"{u'country': u'US', u'short': u'Indiana Univ., The Lilly Library', u'name': u'Indiana Univ., The Lilly Library'}",2,"[e-it, n-us-in]","[Italy, United States]","[Florence, Bloomington]","[43.77925, 39.16533]","[11.24626, -86.52639]","[1481, 1960]","[1481, 2021]","[[15], [20]]",True,"[Italy, United States]","[43.77925, 39.16533]","[11.24626, -86.52639]","[accurate, accurate]",https://data.cerl.org/mei/02141440,"[accurate, accurate]","[accurate, accurate]","[43.77925, 39.16533]","[11.24626, -86.52639]","[1481, 1960]","[1481, 2021]"
